Urdu_Idiom,English_Meaning,Best_Match,Similarity,ai_sentence,Idiomatic_Sent,Translation_Instruction,Urdu_Sentence_3.5,Urdu_Sentence_4o,3.5_Evaluation_4,4o_Evaluation_4,3.5_Evaluation_4o,4o_Evaluation_4o
محنت کامیابی کی کنجی ہے۔,Hard work is the key to success.,"no pain, no gain",0.7754333019256592,yes,"She reminded herself that no pain, no gain, as she pushed through the last mile of her morning run.","'محنت کامیابی کی کنجی ہے۔' means 'no pain, no gain'. Given the above knowledge translate the following sentence to Urdu: 'She reminded herself that no pain, no gain, as she pushed through the last mile of her morning run.'",وہ اپنے آپ کو یاد دلاتی رہی تھی کہ محنت کامیابی کی کنجی ہے، جب وہ صبح کی رننگ کے آخری میل کو تکمیل کر رہی تھی۔,اُس نے خود کو یاد دلایا کہ محنت کامیابی کی کنجی ہے، جب وہ اپنی صبح کی دوڑ کے آخری میل کو عبور کر رہی تھی۔,2.0,2.0,2.0,2.0
مشق انسان کو کامل بنا دیتی ہے۔,Practice makes a person perfect.,practice makes perfect,0.8546755313873291,no,There is nothing like enough practice and eventually it is the practice that will make you perfect .,'مشق انسان کو کامل بنا دیتی ہے۔' means 'practice makes perfect'. Given the above knowledge translate the following sentence to Urdu: 'There is nothing like enough practice and eventually it is the practice that will make you perfect .',کافی مشق کی کوئی بات نہیں اور آخر کار مشق ہی آپ کو کامل بنائے گی۔,کافی مشق جیسی کوئی چیز نہیں ہے اور بالآخر یہی مشق آپ کو کامل بنائے گی۔,3.0,3.0,3.0,2.0
وقت کسی کا انتظار نہیں کرتا۔,Time waits for no one.,time and tide wait for no man,0.7362501621246338,yes,"No matter how much he procrastinated, he eventually realized that time and tide wait for no man.","'وقت کسی کا انتظار نہیں کرتا۔' means 'time and tide wait for no man'. Given the above knowledge translate the following sentence to Urdu: 'No matter how much he procrastinated, he eventually realized that time and tide wait for no man.'",چاہے جتنی دیر ہو، اس نے آخر کار سمجھا کہ وقت کسی کا انتظار نہیں کرتا۔,چاہے وہ کتنا بھی ٹال مٹول کرتا رہا، آخرکار اس نے یہ حقیقت جان لی کہ وقت کسی کا انتظار نہیں کرتا۔,3.0,3.0,3.0,3.0
دیر آید درست آید۔,Better late than never.,better late than never,0.9761054515838624,yes,"She finally submitted her project a day before the deadline, thinking, ""Better late than never.""","'دیر آید درست آید۔' means 'better late than never'. Given the above knowledge translate the following sentence to Urdu: 'She finally submitted her project a day before the deadline, thinking, ""Better late than never.""'","وہ انجامیہ اپنے منظر نامے کو مہلت سے ایک دن پہلے جمع کرائیں، سوچتے ہوئے، ""دیر آید درست آید۔""","اُس نے آخرکار اپنا پروجیکٹ آخری تاریخ سے ایک دن پہلے جمع کروا دیا، سوچتے ہوئے، ""دیر آید درست آید۔""",3.0,3.0,3.0,3.0
محبت اندھی ہوتی ہے۔,Love is blind.,love is blind,0.9760262966156006,yes,"Despite his many flaws, she couldn't see them because love is blind.","'محبت اندھی ہوتی ہے۔' means 'love is blind'. Given the above knowledge translate the following sentence to Urdu: 'Despite his many flaws, she couldn't see them because love is blind.'",ان کی بہت سی خامیوں کے باوجود، وہ انہیں دیکھ نہیں سکتی تھی کیونکہ محبت اندھی ہوتی ہے۔,'بہت سی خامیوں کے باوجود، وہ انہیں دیکھ نہیں سکتی تھی کیونکہ محبت اندھی ہوتی ہے۔',3.0,3.0,3.0,3.0
محبت اور جنگ میں ہر چیز جائز ہوتی ہے۔,Everything is fair in love and war,all is fair in love and war,0.946670949459076,yes,"When he found out she had been secretly planning the surprise party for weeks, he couldn't be upset because all is fair in love and war.","'محبت اور جنگ میں ہر چیز جائز ہوتی ہے۔' means 'all is fair in love and war'. Given the above knowledge translate the following sentence to Urdu: 'When he found out she had been secretly planning the surprise party for weeks, he couldn't be upset because all is fair in love and war.'",جب اس نے یہ پتا چلا کہ وہ ہفتوں سے راز کے سرپرست تقریب کی منصوبہ بندی کر رہی تھی، تو وہ ناراض نہیں ہو سکتا تھا کیونکہ محبت اور جنگ میں ہر چیز جائز ہوتی ہے۔,جب اسے پتہ چلا کہ وہ ہفتوں سے خفیہ طور پر سرپرائز پارٹی کی منصوبہ بندی کر رہی تھی، تو وہ ناراض نہیں ہو سکتا تھا کیونکہ محبت اور جنگ میں ہر چیز جائز ہوتی ہے۔,3.0,3.0,3.0,3.0
دل کو دل سے راہ ہوتی ہے۔,The heart finds its way through the heart.,heart to heart,0.8447049856185913,yes,"After years of misunderstanding, they finally had a heart to heart and resolved their differences.","'دل کو دل سے راہ ہوتی ہے۔' means 'heart to heart'. Given the above knowledge translate the following sentence to Urdu: 'After years of misunderstanding, they finally had a heart to heart and resolved their differences.'",سالوں کی بے تفہمی کے بعد، انہوں نے آخرکار دل سے دل کی بات کی اور اپنے فرقے حل کیے۔,سالوں کی غلط فہمیوں کے بعد، آخرکار انہوں نے دل کو دل سے بات کی اور اپنے اختلافات کو حل کر لیا۔,3.0,3.0,2.0,3.0
دوستوں کو قریب لیکن دشمنوں کو قریب تر رکھو۔,Keep friends close but keep enemies closer.,keep your friends close and your enemies closer,0.911809265613556,no,As a politician you must keep your friends close and your enemies closer .,'دوستوں کو قریب لیکن دشمنوں کو قریب تر رکھو۔' means 'keep your friends close and your enemies closer'. Given the above knowledge translate the following sentence to Urdu: 'As a politician you must keep your friends close and your enemies closer .','ایک سیاستدان کے طور پر آپ کو اپنے دوستوں کو قریب رکھنا چاہئے اور اپنے دشمنوں کو قریب تر رکھنا چاہئے۔',سیاستدان کے طور پر آپ کو دوستوں کو قریب لیکن دشمنوں کو قریب تر رکھنا چاہیے۔,3.0,3.0,3.0,3.0
اپنا اپنا غیر غیر,Blood is thicker than water,blood is thicker than water,1.0,no,"When you get into trouble , usually your family will be the ones to bail you out , not your friends and After all , blood is thicker than water .","'اپنا اپنا غیر غیر' means 'blood is thicker than water'. Given the above knowledge translate the following sentence to Urdu: 'When you get into trouble , usually your family will be the ones to bail you out , not your friends and After all , blood is thicker than water .'",جب آپ مشکل میں پڑ جائیں، عام طور پر آپ کو آپ کے خاندان والے بچاتے ہیں، دوست نہیں اور آخر کار، اپنا اپنا غیر غیر ہوتا ہے۔,جب آپ مشکل میں پڑتے ہیں تو عام طور پر آپ کا خاندان ہی آپ کی مدد کرے گا، نہ کہ آپ کے دوست اور آخرکار، اپنا اپنا غیر غیر۔,2.0,1.0,1.0,1.0
آسمان سے گرا کھجورمیں اٹکا,Out of the frying pan into the fire,out of the frying pan into the fire,1.0,no,"In a bid to gain independence , she agreed to get married early , not knowing she was jumping out of the frying pan into the fire .","'آسمان سے گرا کھجورمیں اٹکا' means 'out of the frying pan into the fire'. Given the above knowledge translate the following sentence to Urdu: 'In a bid to gain independence , she agreed to get married early , not knowing she was jumping out of the frying pan into the fire .'",'آزادی حاصل کرنے کی کوشش میں، اس نے جلد شادی کرنے کے لیے رضامند ہوگئی، جانتی نہ تھی کہ وہ آسمان سے گرا کھجور میں اٹکی ہوئی ہے۔',آزادی حاصل کرنے کی کوشش میں، اُس نے جلدی شادی کرنے پر رضامندی ظاہر کردی، یہ جانے بغیر کہ وہ آسمان سے گر کر کھجور میں اٹک رہی تھی۔,2.0,2.0,3.0,3.0
آنکھ اوجھل پہاڑاوجھل,"Out of sight, out of mind","out of sight, out of mind",1.0,no,"It is out of sight , out of mind for them but that is not a good thing in any way .","'آنکھ اوجھل پہاڑاوجھل' means 'out of sight, out of mind'. Given the above knowledge translate the following sentence to Urdu: 'It is out of sight , out of mind for them but that is not a good thing in any way .'",یہ ان کے لیے آنکھ اوجھل پہاڑاوجھل ہے لیکن یہ کسی بھی طریقے میں اچھی بات نہیں ہے۔,یہ ان کے لئے آنکھ اوجھل پہاڑ اوجھل ہے لیکن یہ کسی بھی طرح سے اچھی بات نہیں ہے۔,2.0,3.0,3.0,3.0
آدھا تیتر آدھا بٹیر,Neither fish nor fowl,neither fish nor fowl,1.0,yes,"The new hybrid gadget is neither fish nor fowl, leaving consumers confused about its true purpose.","'آدھا تیتر آدھا بٹیر' means 'neither fish nor fowl'. Given the above knowledge translate the following sentence to Urdu: 'The new hybrid gadget is neither fish nor fowl, leaving consumers confused about its true purpose.'",نیا ہائبرڈ گیجٹ نہ تو مچھلی ہے اور نہ ہی مرغی، جس سے صارفین کو اس کے اصل مقصد کے بارے میں الجھن ہے۔,نیا ہائبرڈ گیجٹ آدھا تیتر آدھا بٹیر ہے، جس کی وجہ سے صارفین اس کے حقیقی مقصد کے بارے میں الجھن کا شکار ہیں۔,3.0,2.0,3.0,3.0
ادلے کا بدلہ,Tit for tat,tit for tat,1.0000001192092896,yes,"After John spread rumors about her, Mary decided to give him a taste of his own medicine, engaging in a tit for tat strategy.","'ادلے کا بدلہ' means 'tit for tat'. Given the above knowledge translate the following sentence to Urdu: 'After John spread rumors about her, Mary decided to give him a taste of his own medicine, engaging in a tit for tat strategy.'",جان نے اس کے بارے میں افواہیں پھیلائیں تو مریم نے اسے ادلے کا بدلہ دینے کا فیصلہ کیا، اور اس نے اس کو اپنی ہی دوائی پلانے میں شامل کر لیا۔,جان کے اس کے بارے میں افواہیں پھیلانے کے بعد، مریم نے اسے ادلے کا بدلہ دینے کا فیصلہ کیا۔,3.0,2.0,3.0,3.0
سہج پکے سو میٹھا ہو,Slow and steady wins the race,slow and steady wins the race,0.9999998807907104,yes,"Despite the pressure to hurry, he reminded himself that slow and steady wins the race.","'سہج پکے سو میٹھا ہو' means 'slow and steady wins the race'. Given the above knowledge translate the following sentence to Urdu: 'Despite the pressure to hurry, he reminded himself that slow and steady wins the race.'",جلدی کرنے کی دباؤ کے باوجود، اس نے خود کو یاد دلایا کہ سہج پکے سو میٹھا ہو۔,دباؤ کے باوجود، اس نے خود کو یاد دلایا کہ سہج پکے سو میٹھا ہو۔,2.0,2.0,3.0,3.0
بہتی گنگا میں ہاتھ دھونا,To use available opportunity,make hay while the sun shines,0.7655985951423645,yes,"With the unexpected boom in sales, the company decided to make hay while the sun shines and launched several new products.","'بہتی گنگا میں ہاتھ دھونا' means 'make hay while the sun shines'. Given the above knowledge translate the following sentence to Urdu: 'With the unexpected boom in sales, the company decided to make hay while the sun shines and launched several new products.'",غیر متوقع فروخت میں اضافے سے، کمپنی نے سورج نکلتے وقت بہتی گنگا میں ہاتھ دھونے کا فیصلہ کیا اور کئی نئے مصنوعات لانچ کیے۔,سیلز میں غیر متوقع تیزی کے ساتھ، کمپنی نے بہتی گنگا میں ہاتھ دھونے کا فیصلہ کیا اور کئی نئے مصنوعات لانچ کیں۔,2.0,2.0,1.0,3.0
اب پچھتاۓ کیا ہؤت جب چڑیا چگ گئ کھیت,It is no use crying over spilled milk,don't cry over spilt milk,0.7578192949295044,yes,There's no use in getting upset about the missed opportunity; you shouldn't cry over spilt milk.,'اب پچھتاۓ کیا ہؤت جب چڑیا چگ گئ کھیت' means 'don't cry over spilt milk'. Given the above knowledge translate the following sentence to Urdu: 'There's no use in getting upset about the missed opportunity; you shouldn't cry over spilt milk.','موقع گئے بھولا کرنے سے کوئی فائدہ نہیں، آپ کو چڑیا چگ گئی دودھ پر رونا چاہئے۔',چھوٹی ہوئی موقع پر افسوس کرنے کا کوئی فائدہ نہیں؛ اب پچھتاۓ کیا ہؤت جب چڑیا چگ گئ کھیت۔,2.0,3.0,1.0,3.0
دونوں ہاتھوں سے دولت لٹانا,To burn the candle at both ends,burn the candle at both ends,0.970807671546936,yes,"Working two jobs and studying at night, she's really burning the candle at both ends.","'دونوں ہاتھوں سے دولت لٹانا' means 'burn the candle at both ends'. Given the above knowledge translate the following sentence to Urdu: 'Working two jobs and studying at night, she's really burning the candle at both ends.'",دو نوکریوں پر کام کرتے ہوئے رات کو پڑھائی کرنا، وہ واقعی دونوں ہاتھوں سے دولت لٹا رہی ہے۔,دو نوکریاں کرتے ہوئے اور رات کو پڑھائی کرتے ہوئے، وہ واقعی دونوں ہاتھوں سے دولت لٹا رہی ہے۔,1.0,1.0,1.0,1.0
ہتھیلی پر سرسوں نہیں جمتی,Rome was not built on a day,rome was not built in one day,0.9655030369758606,yes,"Learning a new language can be challenging, but remember, Rome was not built in one day.","'ہتھیلی پر سرسوں نہیں جمتی' means 'rome was not built in one day'. Given the above knowledge translate the following sentence to Urdu: 'Learning a new language can be challenging, but remember, Rome was not built in one day.'",ایک نئی زبان سیکھنا مشکل ہو سکتا ہے، مگر یاد رکھیں، ہتھیلی پر سرسوں نہیں جمتی۔,نئی زبان سیکھنا مشکل ہو سکتا ہے، لیکن یاد رکھیں، ہتھیلی پر سرسوں نہیں جمتی۔,2.0,2.0,3.0,3.0
اونٹ کے منہ میں زیرہ,A drop into the ocean,a drop in the bucket (or ocean),0.7430707216262817,yes,"Donating a few dollars to the massive relief fund felt like a drop in the bucket, but every contribution counted.","'اونٹ کے منہ میں زیرہ' means 'a drop in the bucket (or ocean)'. Given the above knowledge translate the following sentence to Urdu: 'Donating a few dollars to the massive relief fund felt like a drop in the bucket, but every contribution counted.'",کچھ ڈالر عوامی امدادی فنڈ میں دینا اونٹ کے منہ میں زیرہ محسوس ہوا، مگر ہر شراکت گنی۔,بڑے امدادی فنڈ میں چند ڈالر دینا اونٹ کے منہ میں زیرہ لگ رہا تھا، لیکن ہر تعاون کی اہمیت تھی۔,2.0,3.0,3.0,3.0
اول خویش بعد درویش,Charity begins at home,charity begins at home,1.0,yes,"Before donating to international causes, remember that charity begins at home and consider helping your local community first.","'اول خویش بعد درویش' means 'charity begins at home'. Given the above knowledge translate the following sentence to Urdu: 'Before donating to international causes, remember that charity begins at home and consider helping your local community first.'",بین الاقوامی مدد کرنے سے پہلے یاد رکھیں کہ اول خویش بعد درویش ہوتی ہے اور پہلے اپنی مقامی کمیونٹی کی مدد کرنے کو غور سے سوچیں۔,بین الاقوامی مقاصد کے لیے عطیہ کرنے سے پہلے یاد رکھیں کہ اول خویش بعد درویش اور پہلے اپنے مقامی کمیونٹی کی مدد پر غور کریں۔,3.0,3.0,3.0,3.0
بغل میں چھری منہ میں رام رام,A wolf in sheep’s clothing,a wolf in sheep's clothing,0.9985247850418092,yes,"Despite his friendly demeanor, Jake turned out to be a wolf in sheep's clothing, betraying everyone's trust for his own gain.","'بغل میں چھری منہ میں رام رام' means 'a wolf in sheep's clothing'. Given the above knowledge translate the following sentence to Urdu: 'Despite his friendly demeanor, Jake turned out to be a wolf in sheep's clothing, betraying everyone's trust for his own gain.'",جیک کا دوستانہ مزاج ہونے کے باوجود یہ ظاہر ہوا کہ وہ بغل میں چھری تھا، اپنے مفاد کے لئے سب کا بھروسہ دہوکہ دیتے ہوئے۔,دوستانہ رویے کے باوجود، جیک بغل میں چھری منہ میں رام رام نکلا، جس نے اپنے فائدے کے لئے سب کے اعتماد کو دھوکہ دیا۔,2.0,2.0,1.0,3.0
بھینس کے آگے بین بجانا,Casting pearls before swine,cast pearls before swine,0.9252103567123412,yes,Sharing advanced literary analysis with someone who never reads is like casting pearls before swine.,'بھینس کے آگے بین بجانا' means 'cast pearls before swine'. Given the above knowledge translate the following sentence to Urdu: 'Sharing advanced literary analysis with someone who never reads is like casting pearls before swine.',جو کبھی کتاب نہیں پڑھتا، اس کے ساتھ ترقی یافتہ ادبی تجزیہ بانٹنا بھینس کے آگے بین بجانا کی طرح ہے۔,کسی ایسے شخص کے ساتھ اعلیٰ ادبی تجزیہ شئیر کرنا جو کبھی نہیں پڑھتا، بھینس کے آگے بین بجانا ہے۔,3.0,2.0,3.0,3.0
پہلے تولوپھر بولو,Think before you leap,look before you leap,0.8946018218994141,no,You better check out the costs that you will have to incur through the duration of this lawsuit before filling it and It is always better to look before you leap .,'پہلے تولوپھر بولو' means 'look before you leap'. Given the above knowledge translate the following sentence to Urdu: 'You better check out the costs that you will have to incur through the duration of this lawsuit before filling it and It is always better to look before you leap .',تمہیں بہتر ہوگا کہ تو اس مقدمہ کے دوران جو خرچے تمہیں برداشت کرنے پڑیں گے ان کا جائزہ لیا کرو پھر مقدمہ درج کرنا، اور ہمیشہ پہلے تولو پھر بولو کرنا بہتر ہوتا ہے۔,آپ کو یہ مقدمہ دائر کرنے سے پہلے ان اخراجات کا جائزہ لینا چاہیے جو آپ کو اس کے دوران برداشت کرنے ہوں گے اور ہمیشہ پہلے تولو پھر بولو بہتر ہے۔,3.0,3.0,3.0,3.0
آگے کنواں پیچھے کھائی,Between the devil and the deep sea,between the devil and the deep blue sea,0.9378265142440796,yes,"Finding himself between the devil and the deep blue sea, Jack had to choose between losing his job or betraying his best friend.","'آگے کنواں پیچھے کھائی' means 'between the devil and the deep blue sea'. Given the above knowledge translate the following sentence to Urdu: 'Finding himself between the devil and the deep blue sea, Jack had to choose between losing his job or betraying his best friend.'",جیک نے خود کو آگے کنواں پیچھے کھائی میں پایا، اسے اپنی نوکری کھو دینے یا اپنے بہترین دوست کو دھوکا دینے کے درمیان انتخاب کرنا پڑا۔,'آگے کنواں پیچھے کھائی میں پھنسا ہوا، جیک کو اپنی نوکری کھونے یا اپنے بہترین دوست سے غداری کرنے کے درمیان انتخاب کرنا پڑا۔',3.0,3.0,3.0,3.0
بات کا بتنگڑ بنانا,To make a mountain of a maul hill,make a mountain out of a molehill,0.7713894248008728,no,"You are just making a mountain out of a molehill , you just gave a wrong answer , it does n't mean you 're not going to qualify to the second round .","'بات کا بتنگڑ بنانا' means 'make a mountain out of a molehill'. Given the above knowledge translate the following sentence to Urdu: 'You are just making a mountain out of a molehill , you just gave a wrong answer , it does n't mean you 're not going to qualify to the second round .'",تم صرف بات کا بتنگڑ بنا رہے ہو، تم نے صرف غلط جواب دیا ہے، یہ تو مطلب نہیں کہ تم دوسرے راؤنڈ میں قابل نہیں ہوگے۔,تم بات کا بتنگڑ بنا رہے ہو، تم نے صرف غلط جواب دیا ہے، اس کا مطلب یہ نہیں کہ تم دوسرے راؤنڈ کے لئے کوالیفائی نہیں کرو گے۔,3.0,3.0,3.0,3.0
بہتے دریا میں ہاتھ دھونا,To strike while the iron is hot,strike while the iron is hot,0.9625189900398254,no,"The study plans were such that it required you to read when your mind was fresh , strike while the iron is hot .","'بہتے دریا میں ہاتھ دھونا' means 'strike while the iron is hot'. Given the above knowledge translate the following sentence to Urdu: 'The study plans were such that it required you to read when your mind was fresh , strike while the iron is hot .'",مطالعہ کے منصوبے ایسے تھے کہ آپ کو پڑھنے کی ضرورت تھی جب آپ کا دماغ تازہ ہوتا، بہتے دریا میں ہاتھ دھونا۔,مطالعے کے منصوبے ایسے تھے کہ جب آپ کا ذہن تازہ ہو تو پڑھنے کی ضرورت تھی، بہتے دریا میں ہاتھ دھونا۔,1.0,1.0,1.0,1.0
جلدی کا کام شیطان کا,Haste makes waste,haste makes waste,1.000000238418579,no,"Try not to rush through things , even though you are in a hurry because haste makes waste .","'جلدی کا کام شیطان کا' means 'haste makes waste'. Given the above knowledge translate the following sentence to Urdu: 'Try not to rush through things , even though you are in a hurry because haste makes waste .'",جلدی سے کام کرنے سے بچیں، چاہے آپ جلدی میں ہی کیوں نہ ہوں، کیونکہ جلدی کا کام شیطان کا ہوتا ہے۔,چیزوں کو جلدی جلدی کرنے کی کوشش نہ کریں، اگرچہ آپ کو جلدی ہو کیونکہ جلدی کا کام شیطان کا۔,2.0,2.0,2.0,1.0
کام پیارا ہے جام پیارا نہیں,Handsome is that handsome does,handsome is as handsome does,0.9719446301460266,yes,"Despite his charming looks, he proved that handsome is as handsome does by volunteering tirelessly at the local shelter.","'کام پیارا ہے جام پیارا نہیں' means 'handsome is as handsome does'. Given the above knowledge translate the following sentence to Urdu: 'Despite his charming looks, he proved that handsome is as handsome does by volunteering tirelessly at the local shelter.'","اس کے دلکش انداز پر بھی، اس نے اپنی خوبصورتی کو ثابت کر دیا کہ ""کام پیارا ہے جام پیارا نہیں""، جب وہ مقامی شیلٹر میں بے حد خوشی سے خدمت انجام دیتا رہا۔",خوبصورت نظر آنے کے باوجود، اس نے مقامی پناہ گاہ میں مسلسل رضاکارانہ خدمت کر کے ثابت کیا کہ کام پیارا ہے جام پیارا نہیں۔,2.0,2.0,2.0,1.0
قدر کھو دیتا ہے روز کا آنا جانا,Too much familiarity breeds contempt,familiarity breeds contempt,0.9154865145683287,yes,"After working together for years, the constant arguments between the two colleagues proved that familiarity breeds contempt.","'قدر کھو دیتا ہے روز کا آنا جانا' means 'familiarity breeds contempt'. Given the above knowledge translate the following sentence to Urdu: 'After working together for years, the constant arguments between the two colleagues proved that familiarity breeds contempt.'",سالوں تک اکٹھے کام کرنے کے بعد، دونوں ساتھیوں کے درمیان لگاتار جھگڑے اس بات کا ثبوت دیتے ہیں کہ قدر کھو دیتا ہے روز کا آنا جانا۔,سالوں تک ساتھ کام کرنے کے بعد، دونوں ساتھیوں کے درمیان مسلسل جھگڑے اس بات کا ثبوت تھے کہ قدر کھو دیتا ہے روز کا آنا جانا۔,2.0,3.0,3.0,2.0
