Urdu_Idiom,English_Meaning,Best_Match,Similarity,ai_sentence,Idiomatic_Sent,Translation_Instruction,Urdu_Sentence_3.5,Urdu_Sentence_4o,3.5_Evaluation_4,4o_Evaluation_4,3.5_Evaluation_4o,4o_Evaluation_4o
نیم حکیم خطرہ جان نیم ملا خطرہ ایمان,A LITTLE KNOWLEDGE IS DANGEROUS THING,a little learning is a dangerous thing,0.7772916555404663,yes,"He thought he knew how to fix the wiring after watching a few online videos, but a little learning is a dangerous thing.","'نیم حکیم خطرہ جان نیم ملا خطرہ ایمان' means 'a little learning is a dangerous thing'. Given the above knowledge translate the following sentence to Urdu: 'He thought he knew how to fix the wiring after watching a few online videos, but a little learning is a dangerous thing.'",وہ سمجھتا تھا کہ وہ کچھ آن لائن ویڈیوز دیکھ کر تار کی مرمت کرنا جانتا ہے، مگر نیم حکیم خطرہ جان نیم ملا خطرہ ایمان ہے۔,اس نے سوچا کہ چند آن لائن ویڈیوز دیکھ کر وہ وائرنگ ٹھیک کرنا جانتا ہے، لیکن نیم حکیم خطرہ جان نیم ملا خطرہ ایمان۔,3.0,3.0,3.0,3.0
آدمی اپنی صحبت سے پہچانا جاتا ہے,A MAN IS KNOWN BY THE COMPANY HE KEEPS,company man,0.7768895626068115,yes,"John's colleagues always knew him as a company man, loyal to the firm's values and never hesitating to put in extra hours.","'آدمی اپنی صحبت سے پہچانا جاتا ہے' means 'company man'. Given the above knowledge translate the following sentence to Urdu: 'John's colleagues always knew him as a company man, loyal to the firm's values and never hesitating to put in extra hours.'",جان کے ساتھیوں نے ہمیشہ اسے ایک شرکتی آدمی کے طور پر جانا، کمپنی کی قدرتوں کے لئے وفادار اور کبھی بھی اضافی گھنٹے نہیں ڈالنے والا معلوم کیا۔,جان کے ساتھی ہمیشہ اسے آدمی اپنی صحبت سے پہچانا جاتا ہے، فرم کی قدروں سے وفادار اور اضافی وقت لگانے میں کبھی نہیں ہچکچاتے، کے طور پر جانتے تھے۔,2.0,2.0,1.0,1.0
ایفائے عہد کرنیوالا,A MAN OF WORD,man of his word,0.9481512308120728,yes,"Despite the challenges, everyone knew they could trust him because he was a man of his word.","'ایفائے عہد کرنیوالا' means 'man of his word'. Given the above knowledge translate the following sentence to Urdu: 'Despite the challenges, everyone knew they could trust him because he was a man of his word.'",چناچہ مشکلات کے باوجود، ہر کوئی جانتا تھا کے وہ ایفائے عہد کرنیوالا تھا، اس لئے وہ پر اعتماد کر سکتے تھے۔,چیلنجوں کے باوجود، ہر کوئی جانتا تھا کہ وہ اس پر بھروسہ کر سکتے ہیں کیونکہ وہ ایفائے عہد کرنے والا تھا۔,3.0,3.0,2.0,3.0
اپنا مکان کوٹ سمان!,A MAN'S HOUSE IS HIS CASTLE,man's home is his castle,0.9560866951942444,yes,"Regardless of how small or humble, a man's home is his castle, and he should feel like a king within its walls.","'اپنا مکان کوٹ سمان!' means 'man's home is his castle'. Given the above knowledge translate the following sentence to Urdu: 'Regardless of how small or humble, a man's home is his castle, and he should feel like a king within its walls.'",چاہے گھر چھوٹا ہو یا عام، ایک انسان کا گھر اُس کا قلعہ ہوتا ہے، اور اُسے اپنے دیواروں کے اندر بادشاہ کی طرح محسوس ہونا چاہیے۔,چاہے گھر کتنا ہی چھوٹا یا سادہ کیوں نہ ہو، اپنا مکان کوٹ سمان ہے، اور اسے اس کی دیواروں کے اندر بادشاہ جیسا محسوس کرنا چاہیے۔,3.0,3.0,3.0,2.0
کچھ بولو,A PENNY FOR YOUR THOUGHTS,a penny for your thoughts,0.9999998807907104,yes,You've been awfully quiet during the meeting; a penny for your thoughts?,'کچھ بولو' means 'a penny for your thoughts'. Given the above knowledge translate the following sentence to Urdu: 'You've been awfully quiet during the meeting; a penny for your thoughts?','میٹنگ کے دوران آپ بہت چپ ہیں؛ کچھ بولو؟',آپ میٹنگ کے دوران بہت خاموش تھے؛ کچھ بولو؟,1.0,1.0,1.0,1.0
بچایا سو کمایا,A PENNY SAVED IS A PENNY GOT,a penny saved is a penny earned,0.954663872718811,yes,"By choosing to cook at home instead of dining out, she reminded herself that a penny saved is a penny earned.","'بچایا سو کمایا' means 'a penny saved is a penny earned'. Given the above knowledge translate the following sentence to Urdu: 'By choosing to cook at home instead of dining out, she reminded herself that a penny saved is a penny earned.'",وہ گھر پر پکانے کا انتخاب کر کے باہر کھانے کی بجائے، خود کو یاد دلایا کہ بچایا سو کمایا۔,گھر پر کھانا پکانے کا انتخاب کر کے، بجائے باہر کھانے کے، اس نے خود کو یاد دلایا کہ بچایا سو کمایا۔,3.0,3.0,3.0,3.0
بچایا سو پایا,A PENNY SAVED IS PENNY GAINED,a penny saved is a penny earned,0.9491320848464966,yes,"By choosing to cook at home instead of dining out, she remembered that a penny saved is a penny earned.","'بچایا سو پایا' means 'a penny saved is a penny earned'. Given the above knowledge translate the following sentence to Urdu: 'By choosing to cook at home instead of dining out, she remembered that a penny saved is a penny earned.'",وہ یاد کرتی رہی کہ باہر کھانے کی بجائے گھر پر پکانے سے بچایا سو پایا ہے۔,گھر پر کھانا پکانے کا انتخاب کر کے بجائے باہر کھانے کے، اس نے یاد رکھا کہ بچایا سو پایا۔,1.0,1.0,2.0,3.0
انسان کی بابت کافی اندازہ اس کے کھانے سے لگایا جا سکتا ہے,"TELL ME WHAT YOU EAT, AND I WILL TELL YOU WHAT YOU ARE",you are what you eat,0.8010883331298828,yes,"If you want to feel better, remember that you are what you eat, so choose nutritious foods.","'انسان کی بابت کافی اندازہ اس کے کھانے سے لگایا جا سکتا ہے' means 'you are what you eat'. Given the above knowledge translate the following sentence to Urdu: 'If you want to feel better, remember that you are what you eat, so choose nutritious foods.'",اگر آپ محسوس بہتر کرنا چاہتے ہیں، تو یاد رکھیں کہ آپ وہی ہیں جو آپ کھاتے ہیں، لہذا متنوع غذائیں منتخب کریں۔,اگر آپ بہتر محسوس کرنا چاہتے ہیں تو یاد رکھیں کہ انسان کی بابت کافی اندازہ اس کے کھانے سے لگایا جا سکتا ہے، اس لیے غذائیت سے بھرپور کھانے کا انتخاب کریں۔,3.0,3.0,1.0,2.0
اندرونی معاملات کھولنا,TELL TALES OUT OF SCHOOL,tell tales out of school,1.0,yes,He lost the trust of his colleagues because he would often tell tales out of school.,'اندرونی معاملات کھولنا' means 'tell tales out of school'. Given the above knowledge translate the following sentence to Urdu: 'He lost the trust of his colleagues because he would often tell tales out of school.',وہ اپنے ہمکاریوں کا اعتماد کھو دیا کیونکہ وہ اکثر اندرونی معاملات کھولتا تھا۔,اس نے اپنے ساتھیوں کا اعتماد کھو دیا کیونکہ وہ اکثر اندرونی معاملات کھولتا تھا۔,3.0,3.0,2.0,2.0
چور کے گھر مور,THE BITER BIT,the biter bit,1.0,yes,"After years of cheating others out of their money, John found himself scammed out of his entire fortune, proving once again the biter bit.","'چور کے گھر مور' means 'the biter bit'. Given the above knowledge translate the following sentence to Urdu: 'After years of cheating others out of their money, John found himself scammed out of his entire fortune, proving once again the biter bit.'",سالوں تک دوسروں کو دھوکہ دے کر پیسے کمانے والا جان اپنی پوری دولت سے چونا لگا، ایک بار پھر ثابت ہوا کہ چور کے گھر مور۔,سالوں تک دوسروں کے پیسے ہڑپنے کے بعد، جان خود اپنی ساری دولت سے محروم ہو گیا، جو ایک بار پھر ثابت کرتا ہے کہ چور کے گھر مور۔,3.0,3.0,3.0,3.0
پہلے مارے سو میری !,THE EARLY BIRD CATCHETH THE WORM,the early bird gets the worm,0.9395007491111756,yes,"By waking up at dawn to start her studies, Jenna proved that the early bird gets the worm.","'پہلے مارے سو میری !' means 'the early bird gets the worm'. Given the above knowledge translate the following sentence to Urdu: 'By waking up at dawn to start her studies, Jenna proved that the early bird gets the worm.'",جینا نے صبح سویرے اٹھ کر اپنے مطالعے شروع کرنے سے ثابت کیا کہ پہلے مارے سو میری !,جینا نے صبح سویرے اٹھ کر اپنی پڑھائی شروع کر کے ثابت کیا کہ پہلے مارے سو میری۔,1.0,1.0,1.0,3.0
مٹی کی رسی بانٹنا !,YOU ARE WEAVING A ROPE OUT OF SAND,draw a line in the sand,0.76866614818573,yes,"After years of tolerating his disrespect, she finally decided to draw a line in the sand and demanded he either change his behavior or leave.","'مٹی کی رسی بانٹنا !' means 'draw a line in the sand'. Given the above knowledge translate the following sentence to Urdu: 'After years of tolerating his disrespect, she finally decided to draw a line in the sand and demanded he either change his behavior or leave.'",سالوں تک اس کی بے عزتی کو برداشت کرنے کے بعد، اختتام پر انہوں نے مٹی کی رسی بانٹنے کا فیصلہ کیا اور انہوں نے انہیں یا تو اپنے رویہ بدلنے یا چلے جانے کی مطالبہ کی۔,سالوں تک اس کی بے ادبی برداشت کرنے کے بعد، اس نے آخرکار مٹی کی رسی بانٹنے کا فیصلہ کیا اور مطالبہ کیا کہ وہ یا تو اپنا رویہ بدلے یا چلا جائے۔,2.0,2.0,1.0,1.0
مٹی کی رسی بانٹنا,YOU ARE WEAVING A ROPE OUT OF SAND,draw a line in the sand,0.76866614818573,yes,"After weeks of negotiations, the manager decided to draw a line in the sand and refused to make any further concessions.","'مٹی کی رسی بانٹنا' means 'draw a line in the sand'. Given the above knowledge translate the following sentence to Urdu: 'After weeks of negotiations, the manager decided to draw a line in the sand and refused to make any further concessions.'",ہفتوں کی مذاکرات کے بعد، مینیجر نے فیصلہ کیا کہ مٹی کی رسی بانٹے اور کسی اور تسلیمات نہیں کرے۔,ہفتوں کی بات چیت کے بعد، مینیجر نے مٹی کی رسی بانٹنے کا فیصلہ کیا اور مزید رعایتیں دینے سے انکار کر دیا۔,1.0,2.0,1.0,1.0
بے تکلف اور آزاد,HEART TO HEART,heart to heart,0.9999998807907104,yes,"After weeks of tension, they finally had a heart to heart and cleared the air.","'بے تکلف اور آزاد' means 'heart to heart'. Given the above knowledge translate the following sentence to Urdu: 'After weeks of tension, they finally had a heart to heart and cleared the air.'",ہفتوں تنازعے کے بعد، انہوں نے آخرکار دل سے دل بات کرکے حالات صاف کردی۔,ہفتوں کی کشیدگی کے بعد، انہوں نے آخر کار بے تکلف اور آزاد بات کی اور غلط فہمیاں دور کر دیں۔,3.0,3.0,3.0,3.0
اپنی مدد آپ,HELP ONESELF,help yourself,0.8187355995178223,yes,Feel free to help yourself to any of the snacks on the table.,'اپنی مدد آپ' means 'help yourself'. Given the above knowledge translate the following sentence to Urdu: 'Feel free to help yourself to any of the snacks on the table.',میز پر موجود کسی بھی نیازی میں آزادی سے مدد کریں۔,میز پر پڑے کسی بھی ناشتہ سے اپنی مدد آپ کریں۔,1.0,3.0,1.0,1.0
بزدل,HEN-HEARTED,chicken-hearted,0.8641202449798584,yes,"Despite his tough exterior, John revealed his chicken-hearted nature when it came to confronting his boss about the unfair workload.","'بزدل' means 'chicken-hearted'. Given the above knowledge translate the following sentence to Urdu: 'Despite his tough exterior, John revealed his chicken-hearted nature when it came to confronting his boss about the unfair workload.'",جان نے اپنے بوس کے ساتھ غیر منصفانہ ورک لوڈ کے بارے میں بات چیت کرنے کے موقع پر اپنا بزدل پس منظر ظاہر کیا۔,اپنے سخت مزاج کے باوجود، جان نے اپنے بزدلانہ فطرت کا انکشاف کیا جب بات آئی اپنے باس سے غیر منصفانہ کام کے بوجھ کے بارے میں بات کرنے کی۔,3.0,3.0,3.0,3.0
امیر اور غریب ۔ اوپر نیچے ۔ ہر طرف,HIGH AND LOW,high and low,1.0,yes,"I searched high and low for my missing keys, but they were nowhere to be found.","'امیر اور غریب ۔ اوپر نیچے ۔ ہر طرف' means 'high and low'. Given the above knowledge translate the following sentence to Urdu: 'I searched high and low for my missing keys, but they were nowhere to be found.'",میری گمشدہ چابیوں کے لئے میں نے اوپر نیچے تلاش کی، لیکن وہ کہیں نہیں ملیں۔,میں نے اپنی گمشدہ چابیاں امیر اور غریب، اوپر نیچے، ہر طرف ڈھونڈیں، لیکن وہ کہیں نہیں ملیں۔,3.0,1.0,3.0,1.0
فیشن ایبل ۔ معاشرے کی زندگی,HIGH HAND,upper hand,0.8832101821899414,no,The home team got the upper hand when their opponents ' star quarterback went out with an injury ..,'فیشن ایبل ۔ معاشرے کی زندگی' means 'upper hand'. Given the above knowledge translate the following sentence to Urdu: 'The home team got the upper hand when their opponents ' star quarterback went out with an injury ..',گھریلو ٹیم کو فیشن ایبل مل گیا جب ان کے مقابلہ کار ٹیم کا اسٹار کوارٹر باک انجری کی وجہ سے باہر چلا گیا۔,جب مخالف ٹیم کے سٹار کوارٹر بیک چوٹ کی وجہ سے باہر ہو گیا تو ہوم ٹیم کو فیشن ایبل ۔ معاشرے کی زندگی مل گئی۔,2.0,1.0,1.0,1.0
عمل کا وقت,HIGH TIME,high time,1.0,yes,It's high time we addressed the issues that have been plaguing our community for years.,'عمل کا وقت' means 'high time'. Given the above knowledge translate the following sentence to Urdu: 'It's high time we addressed the issues that have been plaguing our community for years.',ہمیں وقت کا عمل ہے کہ ہم ان مسائل کا حل کریں جو ہماری کمیونٹی کو سالوں سے پریشان کر رہی ہیں۔,یہ عمل کا وقت ہے کہ ہم ان مسائل کو حل کریں جو سالوں سے ہماری کمیونٹی کو پریشان کر رہے ہیں۔,3.0,3.0,1.0,1.0
مطلوبہ مقصد حاصل کرنا,HIT THE NAIL ON THE HEAD,hit the nail on the head,0.9999999403953552,no,Stephen hit the nail on the head when he said that what the company was lacking in was clear vision and focus .,'مطلوبہ مقصد حاصل کرنا' means 'hit the nail on the head'. Given the above knowledge translate the following sentence to Urdu: 'Stephen hit the nail on the head when he said that what the company was lacking in was clear vision and focus .',اسٹیفن نے بالی کی سر پر ماری جب انہوں نے کہا کہ کمپنی کو واضح ویژن اور توجہ کی کمی تھی۔,اسٹیفن نے بالکل صحیح نکتہ اٹھایا جب اس نے کہا کہ کمپنی کو جس چیز کی کمی ہے وہ ہے واضح وژن اور توجہ۔,3.0,3.0,3.0,3.0
عشق کی آنکھیں نہیں ہوتیں,LOVE IS ALWAYS BLIND,love is blind,0.8758805990219116,yes,"Despite all their differences and the warnings from friends, they got married because love is blind.","'عشق کی آنکھیں نہیں ہوتیں' means 'love is blind'. Given the above knowledge translate the following sentence to Urdu: 'Despite all their differences and the warnings from friends, they got married because love is blind.'",ان کے تمام فرق اور دوستوں کی ہدایتوں کے باوجود انہوں نے شادی کر لی کیونکہ عشق کی آنکھیں نہیں ہوتیں۔,تمام اختلافات اور دوستوں کی تنبیہات کے باوجود، انہوں نے شادی کر لی کیونکہ عشق کی آنکھیں نہیں ہوتیں۔,3.0,3.0,3.0,3.0
دل لگا گدھی سے تو بری کیا چیز ہے ۔ پیار اندھا ہوتا ہے,LOVE IS BLIND,love is blind,1.0,yes,"Despite all her friends warning her about his flaws, she married him anyway, proving that love is blind.","'دل لگا گدھی سے تو بری کیا چیز ہے ۔ پیار اندھا ہوتا ہے' means 'love is blind'. Given the above knowledge translate the following sentence to Urdu: 'Despite all her friends warning her about his flaws, she married him anyway, proving that love is blind.'",ان کے دوستوں کی تمام ہنرمندیوں کے باوجود، اس نے اس سے شادی کرلی، جو ثابت کرتا ہے کہ پیار اندھا ہوتا ہے۔,اس کے تمام دوستوں نے اسے اس کی خامیوں کے بارے میں خبردار کیا، پھر بھی اس نے اس سے شادی کر لی، ثابت کرتے ہوئے کہ پیار اندھا ہوتا ہے۔,3.0,3.0,3.0,3.0
مجھ سے محبت کرنی ہے تو میری ہر چیز سے محبت کرنی پڑے گی,"LOVE ME, LOVE MY DOG","love me, love my dog",1.000000238418579,yes,"""If you're going to be with me, you need to accept that love me, love my dog.""","'مجھ سے محبت کرنی ہے تو میری ہر چیز سے محبت کرنی پڑے گی' means 'love me, love my dog'. Given the above knowledge translate the following sentence to Urdu: '""If you're going to be with me, you need to accept that love me, love my dog.""'","""اگر تم میرے ساتھ رہنا چاہتے ہو، تو یہ قبول کرنا ہوگا کہ مجھ سے محبت کرنی ہوگی تو میری ہر چیز سے محبت کرنی پڑے گی۔""","""اگر تم میرے ساتھ رہنا چاہتے ہو تو تمہیں یہ قبول کرنا پڑے گا کہ مجھ سے محبت کرنی ہے تو میری ہر چیز سے محبت کرنی پڑے گی۔""",3.0,3.0,2.0,3.0
گلے پڑا ڈھول بجانا !,MAKE A VIRTUE OF NECESSITY,make a virtue of necessity,1.0,yes,"When the company downsized, Sarah made a virtue of necessity by using her newfound free time to start her own successful consulting business.","'گلے پڑا ڈھول بجانا !' means 'make a virtue of necessity'. Given the above knowledge translate the following sentence to Urdu: 'When the company downsized, Sarah made a virtue of necessity by using her newfound free time to start her own successful consulting business.'",جب کمپنی نے کم کارمندی کی، سارہ نے اپنی نئی مفت وقت کا استعمال کر کے اپنی کامیاب مشاورت کی کاروبار شروع کر دی۔,جب کمپنی نے کمی کی، سارہ نے گلے پڑا ڈھول بجانے کا فائدہ اُٹھایا اور اپنے نئے ملنے والے فارغ وقت کو استعمال کرتے ہوئے اپنی کامیاب مشاورتی کاروبار شروع کی۔,2.0,3.0,1.0,2.0
بہتے دریا میں ہاتھ دھونا,MAKE HAY WHILE THE SUN SHINES,make hay while the sun shines,1.0,yes,She decided to make hay while the sun shines and finished all her outdoor tasks before the rain started.,'بہتے دریا میں ہاتھ دھونا' means 'make hay while the sun shines'. Given the above knowledge translate the following sentence to Urdu: 'She decided to make hay while the sun shines and finished all her outdoor tasks before the rain started.',وہ نے فیصلہ کیا کہ بہتے دریا میں ہاتھ دھونا ہے اور برسات شروع ہونے سے پہلے اپنے تمام باہر کے کام ختم کر دیے۔,اس نے فیصلہ کیا کہ بہتے دریا میں ہاتھ دھو لے اور بارش شروع ہونے سے پہلے اپنے سارے باہر کے کام نمٹا لیے۔,2.0,2.0,3.0,3.0
بہتی گنگا میں ہاتھ دھولو - وقت کو غنیمت جانو,MAKE HAY WHILE THE SUN SHINES,make hay while the sun shines,1.0,yes,She decided to make hay while the sun shines and took on extra work during the busy season to save money for her vacation.,'بہتی گنگا میں ہاتھ دھولو - وقت کو غنیمت جانو' means 'make hay while the sun shines'. Given the above knowledge translate the following sentence to Urdu: 'She decided to make hay while the sun shines and took on extra work during the busy season to save money for her vacation.',وہ نے فیصلہ کیا کہ وقت کو غنیمت جانتے ہوئے اضافی کام لے لے اور مصروف موسم میں پیسے بچانے کے لئے مزید کام کرے۔,اس نے بہتی گنگا میں ہاتھ دھونے کا فیصلہ کیا اور مصروف موسم میں اضافی کام لے کر اپنی چھٹی کے لئے پیسے بچائے۔,2.0,2.0,3.0,3.0
بھر پور فائدہ اٹھانا,MAKE THE BEST OF,make the best of,1.0000001192092896,no,The sun was shining so he made the best of his day and went to the beach with his family .,'بھر پور فائدہ اٹھانا' means 'make the best of'. Given the above knowledge translate the following sentence to Urdu: 'The sun was shining so he made the best of his day and went to the beach with his family .',سورج چمک رہا تھا تو اس نے اپنے دن کا بھر پور فائدہ اٹھایا اور اپنے خاندان کے ساتھ ساحل پر چلا گیا۔,سورج چمک رہا تھا، اس نے اپنے دن کا بھرپور فائدہ اٹھایا اور اپنے خاندان کے ساتھ ساحل سمندر پر چلا گیا۔,3.0,3.0,3.0,3.0
جیسے کام نکلے ۔ نکالو !,MAKE YOUR HAY AS BEST YOU MAY,make hay,0.8024934530258179,yes,"With the sun shining brightly and a clear forecast for the week, the farmer decided to make hay while the good weather lasted.","'جیسے کام نکلے ۔ نکالو !' means 'make hay'. Given the above knowledge translate the following sentence to Urdu: 'With the sun shining brightly and a clear forecast for the week, the farmer decided to make hay while the good weather lasted.'",سورج چمکتے ہوئے اور ہفتے کے لیے صاف پیشگوئی کے ساتھ، کسان نے فیصلہ کیا کہ اچھے موسم کے دوران گھاس کٹوائے۔,سورج چمک رہا تھا اور ہفتے کے لیے صاف موسم کی پیشگوئی تھی، کسان نے فیصلہ کیا کہ جیسے کام نکلے ۔ نکالو!,1.0,1.0,1.0,1.0
دوسرے کا کام جاری رکھنا,FOLLOW ON FOLLOW SUIT,follow suit,0.899849534034729,yes,"After seeing her friend donate to the charity, Emma decided to follow suit and contribute as well.","'دوسرے کا کام جاری رکھنا' means 'follow suit'. Given the above knowledge translate the following sentence to Urdu: 'After seeing her friend donate to the charity, Emma decided to follow suit and contribute as well.'",اپنی دوست کو خیرات میں دینے کے بعد، ایما نے فیصلہ کیا کہ اُسی طرح عمل کرے اور خیرات میں شرکت کرے۔,اپنی دوست کو خیرات میں عطیہ کرتے دیکھ کر، ایما نے بھی دوسرے کا کام جاری رکھنے اور اپنا حصہ ڈالنے کا فیصلہ کیا۔,3.0,3.0,3.0,1.0
سیدھے راستے پر چلنا,FOLLOW ONE'S NOSE,follow your nose,0.8621877431869507,yes,"When you're lost in a new city, sometimes it's best to follow your nose and trust your instincts.","'سیدھے راستے پر چلنا' means 'follow your nose'. Given the above knowledge translate the following sentence to Urdu: 'When you're lost in a new city, sometimes it's best to follow your nose and trust your instincts.'",جب آپ کسی نئے شہر میں گم ہو جاتے ہیں، کبھی کبھار بہتر ہوتا ہے کہ آپ اپنی سمجھ پر چل کر سیدھے راستے پر چلیں اور اپنی احساسوں پر اعتبار کریں۔,جب آپ کسی نئے شہر میں کھو جائیں تو کبھی کبھی سیدھے راستے پر چلنا اور اپنے وجدان پر بھروسہ کرنا ہی بہتر ہوتا ہے۔,3.0,2.0,1.0,2.0
